[
  {
    "category": "Bug Fix",
    "description": "Fix layout issue with main container below 768px where bento grid makes the body too small",
    "steps": [
      "Verify current breakpoint behavior on HomePage grid (currently uses md:grid-cols-2 lg:grid-cols-3)",
      "Verify issue reproduced at viewport widths below 768px",
      "Identify that grid remains single column (grid-cols-1) below md breakpoint",
      "Verify container padding (px-8) and grid gap (gap-4) are appropriate for mobile",
      "Consider adjusting bento grid column span pattern (md:col-span-2) to work better at smaller breakpoints",
      "Test alternative approaches: add sm: breakpoint for grid layout between mobile and md",
      "Update HomePage grid classes to use grid-cols-1 sm:grid-cols-2 md:grid-cols-2 lg:grid-cols-3",
      "Adjust bento pattern to only apply at lg breakpoint to prevent layout issues at md/sm",
      "Verify container padding is appropriate (consider reducing px-8 to px-4 at mobile)",
      "Test layout at 320px, 480px, 640px (sm), 768px (md), and 1024px (lg) breakpoints",
      "Verify ExportCard component renders properly at all breakpoints",
      "Verify no horizontal overflow at any breakpoint",
      "Verify grid gap spacing works well across all screen sizes",
      "Verify responsive images and text sizing in cards",
      "Test on actual mobile devices if possible"
    ],
    "passes": true,
    "archivedAt": "2026-02-04T00:00:00.000Z",
    "originalIndex": 0
  },
  {
    "category": "Feature",
    "description": "Automate timestamp updates in data/exports/ files when export string is modified",
    "steps": [
      "Verify current export file structure (lastUpdated field with ISO 8601 timestamp)",
      "Identify all export files in data/exports/ directory (8 files total)",
      "Design automation approach: file watcher vs pre-commit hook vs script",
      "Create script to detect changes in exportString field and update lastUpdated",
      "Implement file watcher or git pre-commit hook to trigger timestamp update",
      "Add detection logic to compare exportString changes",
      "Update lastUpdated field to current ISO 8601 timestamp when exportString changes",
      "Ensure script handles multiple file updates in single commit",
      "Add documentation for the automation process",
      "Test script with manual exportString update",
      "Verify timestamp updates correctly in ISO 8601 format",
      "Verify script doesn't trigger on other field changes (name, description, etc.)",
      "Verify script works across all export files",
      "Add error handling for malformed export files",
      "Consider adding npm script for manual timestamp updates if needed"
    ],
    "passes": true,
    "archivedAt": "2026-02-04T00:00:00.000Z",
    "originalIndex": 1
  },
  {
    "category": "Feature",
    "description": "Add modal gallery on detail page for viewing carousel images in full resolution",
    "steps": [
      "Verify current carousel implementation in AddonDetailPage (lines 123-193)",
      "Verify Dialog component available in components/ui/dialog.tsx",
      "Design modal gallery UX: click image to open, navigation controls, close on ESC/click outside",
      "Create ImageGalleryModal component or use existing Dialog component",
      "Add click handler to carousel images (currently lines 129-139)",
      "Implement modal state management (open/closed, current image index)",
      "Add full-resolution image display in modal with proper aspect ratio",
      "Add navigation controls (prev/next) in modal matching existing carousel controls",
      "Add keyboard navigation (arrow keys, ESC) in modal context",
      "Add indicator dots in modal showing current position",
      "Ensure modal navigation syncs with carousel navigation state",
      "Style modal with glass effects matching app design",
      "Add zoom/pan functionality (optional enhancement)",
      "Add loading states for high-resolution images",
      "Ensure modal is accessible (ARIA labels, focus management)",
      "Test modal on mobile devices (touch gestures)",
      "Verify modal works with single-image and multi-image carousels",
      "Verify modal closes properly and cleans up event listeners",
      "Verify images load at full resolution in modal",
      "Test keyboard navigation doesn't conflict with carousel shortcuts"
    ],
    "passes": true,
    "archivedAt": "2026-02-04T00:00:00.000Z",
    "originalIndex": 2
  },
  {
    "category": "Refactoring",
    "description": "Replace import.meta.glob with barrel export pattern in loadExports.ts for Bun compatibility",
    "steps": [
      "Verify all 9 addon files in data/exports/ directory",
      "Remove import.meta.glob conditional logic (lines 13-32)",
      "Import all addon files directly at top of loadExports.ts",
      "Create addons array with all imported modules",
      "Update loadAllExports() to return the addons array directly",
      "Verify getAddonManifest() works with new implementation",
      "Verify getAddonById() works with new implementation",
      "Test that all 9 addons load correctly (including healthbar-color, edit-mode, cooldown-manager-centered)",
      "Verify HomePage displays all addons",
      "Verify detail pages work for all addons",
      "Update comments to remove references to Vite and auto-discovery",
      "Test build process with bun build",
      "Verify no import errors in production bundle"
    ],
    "passes": true,
    "archivedAt": "2026-02-04T00:00:00.000Z",
    "originalIndex": 3
  },
  {
    "category": "Feature",
    "description": "Support different aspect ratios in addon detail page image carousel without excessive cropping",
    "steps": [
      "Verify current carousel uses `aspect-video` container (line 127) forcing 16:9 ratio",
      "Verify current images use `object-cover` (line 134) causing cropping",
      "Design solution approach: use `object-contain` to preserve full image visibility",
      "Update carousel container to remove fixed `aspect-video` constraint",
      "Implement dynamic aspect ratio based on current image dimensions",
      "Change `object-cover` to `object-contain` in image className (line 134)",
      "Add max-height constraint to prevent extremely tall images from dominating layout",
      "Ensure container maintains reasonable proportions (e.g., min aspect-ratio)",
      "Add background styling to fill letterbox/pillarbox areas when needed",
      "Test with portrait, landscape, and square images",
      "Verify carousel controls (prev/next buttons) remain properly positioned",
      "Verify indicator dots remain visible and properly positioned",
      "Test carousel navigation still works smoothly with opacity transitions",
      "Ensure images load without layout shift",
      "Test responsive behavior on mobile devices",
      "Verify carousel works with single-image and multi-image scenarios"
    ],
    "passes": true,
    "archivedAt": "2026-02-04T00:00:00.000Z",
    "originalIndex": 4
  },
  {
    "category": "UI Enhancement",
    "description": "Make modal gallery dialog background glassy instead of black full-screen overlay",
    "steps": [
      "Verify current modal uses `bg-black/95` full-screen background (line 315)",
      "Replace black background with glassy backdrop effect",
      "Update DialogContent className to use glass styling",
      "Reduce dialog size from `max-w-[95vw] w-full h-[90vh]` to reasonable dimensions that don't cover entire screen",
      "Add backdrop-blur to DialogContent or parent container for glassy effect",
      "Add rounded corners to modal images (currently lacking border-radius at line 323-329)",
      "Ensure rounded corners match the app's design system (check carousel and card images for reference)",
      "Test modal appearance with new glassy background",
      "Verify modal content is still clearly visible and readable",
      "Verify modal images display properly with rounded corners",
      "Verify close button and navigation controls are still accessible",
      "Test on different screen sizes to ensure proper display",
      "Verify clicking outside modal still closes it properly"
    ],
    "passes": true,
    "archivedAt": "2026-02-04T00:00:00.000Z",
    "originalIndex": 5
  },
  {
    "category": "UI Enhancement",
    "description": "Remove unnecessary blur effect from modal gallery trigger hover state",
    "steps": [
      "Verify current hover overlay uses `backdrop-blur-[2px]` (line 180)",
      "Remove `backdrop-blur-[2px]` from the hover overlay className",
      "Keep the `bg-black/20` background for hover indication",
      "Test that Maximize2 icon is still visible on hover",
      "Verify hover effect still provides clear visual feedback",
      "Test hover interaction on desktop and touch devices"
    ],
    "passes": true,
    "archivedAt": "2026-02-04T00:00:00.000Z",
    "originalIndex": 6
  },
  {
    "category": "UI Enhancement",
    "description": "Dynamic sizing for dialog image gallery based on image dimensions",
    "steps": [
      "Verify current modal uses fixed `max-w-5xl` constraint (line 318)",
      "Verify current modal height constraint is `max-h-[85vh]` (line 318)",
      "Remove or increase `max-w-5xl` to allow wider images to display larger (change to `max-w-[95vw]`)",
      "Update height constraint to `max-h-[95vh]` for consistency",
      "Ensure image container (line 321) properly sizes to contain image",
      "Reduce p-16 padding (line 321) to smaller value (e.g., p-4 or p-8) to maximize image display area",
      "Test with landscape images (wide aspect ratios)",
      "Test with portrait images (tall aspect ratios)",
      "Test with square images",
      "Verify navigation controls remain properly positioned at all sizes",
      "Verify indicator dots remain visible and well-positioned",
      "Test on different screen sizes (mobile, tablet, desktop, ultrawide)",